{
  "schema_version": "1.0",
  "library_version": "1.0.0",
  "symbol": "EURUSD",
  "timeframe": "M5",
  "time_basis": "broker",
  "as_of": "2026-09-18T12:00:00",
  "status": "READY",
  "config": {
    "lookback_bars": 500,
    "max_records_per_concept": 100,
    "swing_strength": 5,
    "displacement_baseline": 20,
    "displacement_multiplier": 1.5,
    "displacement_body_fraction": 0.6,
    "min_fvg_pips": 2,
    "max_zone_age": 200,
    "bpr_max_separation": 50,
    "po3_expiry_bars": 20,
    "smt_symbol": "",
    "smt_radius": 1,
    "enable_draw": false,
    "enable_calendar": true,
    "enable_smt": false,
    "enable_po3": true,
    "enable_displacement": true,
    "enable_mss": true,
    "enable_ifvg": true,
    "enable_bpr": true,
    "enable_cs": false,
    "enable_vix": false,
    "sessions": [
      {"name": "Asian", "start_minute": 0, "end_minute": 480},
      {"name": "London", "start_minute": 420, "end_minute": 960},
      {"name": "NewYork", "start_minute": 720, "end_minute": 1260}
    ]
  },
  "modules": [
    {"concept": "FVG", "status": "READY", "as_of": "2026-09-18T12:00:00", "truncated": false, "message": ""},
    {"concept": "IFVG", "status": "READY", "as_of": "2026-09-18T12:00:00", "truncated": false, "message": ""},
    {"concept": "MSS", "status": "READY", "as_of": "2026-09-18T12:00:00", "truncated": false, "message": ""},
    {"concept": "SMT", "status": "DISABLED", "as_of": null, "truncated": false, "message": "No comparison symbol configured"}
  ],
  "records": [
    {
      "id": "mss-001",
      "concept": "MSS",
      "source_time": "2026-09-18T11:30:00",
      "confirmed_at": "2026-09-18T11:55:00",
      "updated_at": "2026-09-18T11:55:00",
      "direction": "bearish",
      "lower": 1.1098,
      "upper": 1.1098,
      "state": "CONFIRMED",
      "active": true,
      "related_ids": ["swing-low-001", "displacement-001"],
      "period_start": null,
      "period_end": null,
      "reference_price": 1.1098,
      "comparison_price": 0,
      "strength": 1.8,
      "reason": "Bearish displacement closed below a confirmed swing low"
    },
    {
      "id": "fvg-001",
      "concept": "FVG",
      "source_time": "2026-09-18T11:00:00",
      "confirmed_at": "2026-09-18T11:05:00",
      "updated_at": "2026-09-18T11:55:00",
      "direction": "bullish",
      "lower": 1.11,
      "upper": 1.1105,
      "state": "BROKEN",
      "active": false,
      "related_ids": [],
      "period_start": null,
      "period_end": null,
      "reference_price": 0,
      "comparison_price": 0,
      "strength": 0,
      "reason": "Close below lower boundary"
    },
    {
      "id": "ifvg-001",
      "concept": "IFVG",
      "source_time": "2026-09-18T11:00:00",
      "confirmed_at": "2026-09-18T11:55:00",
      "updated_at": "2026-09-18T11:55:00",
      "direction": "bearish",
      "lower": 1.11,
      "upper": 1.1105,
      "state": "FRESH",
      "active": true,
      "related_ids": ["fvg-001"],
      "period_start": null,
      "period_end": null,
      "reference_price": 0,
      "comparison_price": 0,
      "strength": 0,
      "reason": "Bullish FVG invalidated by a closing break"
    }
  ]
}
